{
  "id": "example-config-panel",
  "name": "Example Config Panel",
  "version": "0.2.0",
  "manifest_version": "4",
  "license": "MIT",
  "management_ui": {
    "entry": "ui/index.html",
    "pages": [
      {
        "id": "config",
        "label": "配置页面"
      },
      {
        "id": "notes",
        "label": "账号备注",
        "scope": "bot_account"
      }
    ]
  },
  "default_config": {
    "default_city": "北京",
    "unit": "celsius"
  },
  "commands": [
    {
      "id": "config-panel",
      "name": "config_panel",
      "description": "Read and update plugin-local config values.",
      "usage": "/config_panel [city]",
      "permission": "everyone",
      "trigger": {
        "type": "exact",
        "names": [
          "config_panel"
        ]
      }
    }
  ],
  "min_core_version": "0.4.0",
  "metadata": {
    "description": "Go and Vue example plugin demonstrating the init config snapshot and config.write.",
    "author": "raylea"
  },
  "events": [
    "message.group",
    "message.private",
    "config.changed"
  ]
}
